### ISSUE TITLE
ip65: the first send to an off-subnet peer always fails (ARP not yet resolved), and session_initiate treats it as fatal — the first handshake can never succeed

### ISSUE THREAD

**Issue by JC-000** [JC-000/c64-wireguard#120]
Measured 2026-09-03 on bridged Ethernet VICE (C64 on the real LAN at 10.43.23.225, peer = Cloudflare WARP 162.159.192.1:2408), while running the ip65 end-to-end test for #70.

## Mechanism

ip65 does not queue a datagram whose next-hop MAC it does not know. It emits an ARP request and returns carry set. `src/net/ip65/net.s:net_udp_send` propagates that carry faithfully. `session_initiate` treats carry set as a fatal handshake failure, prints `HANDSHAKE SEND FAILED` and drops to IDLE.

Because Cloudflare is off-subnet, the next hop is the gateway, so this fires on the very first send after `net_init`. Measured by calling `net_udp_send` directly through a stub, which reaches the send without paying the 301 s of X25519 the menu path pays first:

```
send attempt 1: carry=1 (FAIL)   ARP rows: 0
send attempt 2: carry=0 (OK)     ARP rows: 2
send attempt 3: carry=0 (OK)

13:50:01.348916 ARP, Request who-has 10.43.23.1 tell 10.43.23.225
13:50:01.349200 ARP, Reply 10.43.23.1 is-at 8c:30:66:f4:83:ef
13:50:02.856753 IP 10.43.23.225.51820 > 162.159.192.1.2408: UDP, length 148
```

So the send path itself is correct once the cache is warm, and #118's port fix is confirmed on the real wire (148 bytes, from 51820, to port 2408).

Ruled out: the interface config is right. Read over DMA after `I`: address 10.43.23.225, netmask 255.255.255.0, gateway 10.43.23.1, DNS 10.43.23.1, all from the real router's DHCP.

## Why no test caught it

Every Ethernet-VICE suite so far uses a peer on the same subnet, and the host pings the C64 before the run, so the ARP cache is already warm. An off-subnet peer is the first case that needs resolution at send time. Combined with #118 this means the ip65 backend has never completed a handshake with a real peer.

## Fix

The backend's contract is "send it or report a real failure" — the UCI adapter blocks until the firmware has taken the datagram, and ip65 should behave the same. In `src/net/ip65/net.s:net_udp_send`, when the send fails with the ARP cache cold, pump `ip65_process` and retry for a bounded period (a LAN resolves in milliseconds; a budget of ~2 s is generous) before returning carry set. Do not paper over it in `session_initiate`, which would leave every other caller exposed.

Note there is no `net_last_error` under ip65, so a failure here is invisible to any structural probe; only the on-screen message shows it. That is the same class as #116 and is worth addressing alongside.

## Acceptance

- A red test proving the first send to an off-subnet destination fails on the current code and succeeds after the fix, with the ARP exchange and the datagram counted at a wire tap.
- The ip65 Cloudflare end-to-end run (handshake, ping, DNS, rekey) completing on bridged VICE.

**Comment by JC-000** [comment]
Fixed in #122, merged to master via #125 (`9458f97`). `net_udp_send` now pumps the driver and re-calls the send when the next-hop MAC is unresolved, bounded to ~0.5 s, and the ip65 backend gained the structural error channel it never had. Verified red/green on bridged Ethernet VICE — first send to an off-subnet peer returns C=1 with zero datagrams on the unfixed tree, C=0 with a byte-identical packet on the fixed one — and end to end against Cloudflare in #124. Remaining follow-up is #123, the untested drop counter.
